{
  "schema": "resasm_sensitivity_request_v1",
  "material": "umat_m2_cubic_oti.obj",
  "model": "single_c3d8.inp",
  "record": "m2_cubic.resrec.h5",
  "scope": {
    "domain": "ALL",
    "increments": "ALL_CONVERGED"
  },
  "requests": [
    {
      "output": "S",
      "with_respect_to": [
        "C11",
        "C12",
        "C44"
      ]
    }
  ]
}