{
  "schema": "resasm_sensitivity_request_v1",
  "material": "umat_m1_elastic_oti.obj",
  "model": "single_c3d8.inp",
  "record": "m1_elastic.resrec.h5",
  "scope": {
    "domain": "ALL",
    "increments": "ALL_CONVERGED"
  },
  "requests": [
    {
      "output": "S",
      "with_respect_to": [
        "E",
        "nu"
      ]
    }
  ]
}