{
  "schema": "resasm_sensitivity_request_v1",
  "material": "umat_sweep_j2_combined_oti.obj",
  "model": "single_c3d8.inp",
  "record": "sweep_j2_combined.resrec.h5",
  "scope": {
    "domain": "ALL",
    "increments": "ALL_CONVERGED"
  },
  "requests": [
    {
      "output": "S",
      "with_respect_to": [
        "E",
        "nu",
        "SIGY0",
        "HISO",
        "HKIN"
      ]
    }
  ]
}